{
  "$schema": "https://alice51849.github.io/ios-app-guide/institutional/apple-managed-apps.schema.json",
  "schema_version": 1,
  "release_status": "CANDIDATE_NOT_DEPLOYED",
  "deployment_status": "not_deployed",
  "locale": "en-CA",
  "route_kind": "localized",
  "url": "https://alice51849.github.io/ios-app-guide/en-CA/institutional/apple-managed-apps.json",
  "generated_on": "2026-08-30",
  "source_digest": "sha256:eec819d1478d49b6b0e0d97c6e1d253a248e3cf76cfe936124e2f4b2c9224e2e",
  "roster_digest": "sha256:fea82924a4facecbf07394ed7e86d966970b2ba8db1fa21110d5debbde6a8f18",
  "publisher": {
    "name": "Lumi Studio",
    "relationship": "first_party_developer",
    "is_independent_ranking": false,
    "support_email": "hourstag.app@gmail.com"
  },
  "disclosures": {
    "first_party_non_ranking_non_endorsement": "This is Lumi Studio’s first-party roster, not Apple or Microsoft certification or endorsement, school-board or MDM approval, proof of catalogue visibility, or evidence of a discount. Verify the live store and your organization’s policy.",
    "live_policy_note": "A first-party, non-ranking reference for Apple School Manager, Apple Business Manager and Microsoft Intune administrators evaluating 46 verified-live App Store listings for Canadian school boards and organizations.",
    "public_lookup_scope": "This is Lumi Studio’s first-party roster, not Apple or Microsoft certification or endorsement, school-board or MDM approval, proof of catalogue visibility, or evidence of a discount. Verify the live store and your organization’s policy."
  },
  "official_references": [
    {
      "id": "apple-content-distribution",
      "publisher": "Apple",
      "source_title": "Intro to content distribution for Apple devices",
      "url": "https://support.apple.com/guide/deployment/intro-to-content-distribution-depe1553f932/web",
      "checked_on": "2026-08-30",
      "expires_on": "2026-09-13"
    },
    {
      "id": "apple-managed-apps",
      "publisher": "Apple",
      "source_title": "Distribute managed apps to Apple devices",
      "url": "https://support.apple.com/guide/deployment/distribute-managed-apps-dep575bfed86/web",
      "checked_on": "2026-08-30",
      "expires_on": "2026-09-13"
    },
    {
      "id": "microsoft-intune-direct-store",
      "publisher": "Microsoft",
      "source_title": "Add iOS Store Apps to Microsoft Intune",
      "url": "https://learn.microsoft.com/en-us/intune/app-management/deployment/add-store-ios",
      "checked_on": "2026-08-30",
      "expires_on": "2026-09-13"
    },
    {
      "id": "microsoft-intune-volume-purchase",
      "publisher": "Microsoft",
      "source_title": "Manage Apple Volume-Purchased Apps",
      "url": "https://learn.microsoft.com/en-us/intune/app-management/deployment/manage-vpp-apple",
      "checked_on": "2026-08-30",
      "expires_on": "2026-09-13"
    }
  ],
  "source_state": {
    "public_lookup_checked_at": "2026-08-29T19:55:38Z",
    "storefront_snapshot_checked_at": "2026-08-29T06:31:01Z",
    "apple_lookup_receipt_fetched_at": "2026-08-29T19:55:38Z",
    "apple_lookup_receipt_expires_at": "2026-09-01T19:55:38Z",
    "owner_support_registry_checked_at": "2026-08-29T19:55:38Z",
    "owner_support_registry_expires_at": "2026-09-01T19:55:38Z",
    "portfolio_receipt_sha256": "2abf89e10ced56cb57bd59c172dd8f891266c7a8ad6020abcf2297b7aaaa5654",
    "portfolio_receipt_expires_on": "2026-09-06",
    "official_source_max_age_days": 14,
    "lookup_method": "public_get_plus_pinned_cross_source_receipts",
    "institutional_portal_login": false,
    "deployment_or_submission": false
  },
  "workflow": {
    "paid_apps_and_books": "An up-front paid app can be searched as a candidate in Apps and Books. Public lookup does not prove visibility for your organization; have the Content Manager verify the exact numeric App ID before acquiring licences.",
    "intune_direct_store_free_tier": "Intune’s direct iOS Store app method is only for apps that are free in the App Store. Every free download here is free to start with an optional one-time in-app unlock, so evaluate only the included free tier.",
    "managed_app_iap_warning": "Apple documents that in-app purchases are incompatible with volume purchasing, managed apps and Managed Apple Accounts. Device assignment must not be described as a complete unlock. A full unlock, when needed, must be purchased separately by each user with a personal Apple Account that can make in-app purchases.",
    "related_fit_method": "Education and business shortlists use the published publisher query and decision context. Weak or name-only matches are omitted; omission does not mean an app is unsuitable.",
    "administrator_steps": [
      "Match the numeric App ID and exact URL against the live Canadian App Store listing.",
      "Have the Apps and Books Content Manager confirm availability and licence quantity before any paid acquisition.",
      "For Intune direct-store evaluation, record which functions work in the included free tier without an in-app purchase.",
      "Pilot on the intended supervised, shared or user-enrolled iPad configuration and choose the licence type explicitly.",
      "Complete school-board or organizational privacy, accessibility and provincial policy review; installation is not approval."
    ]
  },
  "canary": {
    "status": "BLOCKED_PENDING_ADMIN_VERIFICATION",
    "reason": "Public GET evidence verifies listing identity, platform and purchase class only. Per-organization Apps and Books visibility, license availability, Intune sync and institutional approval were not checked because this candidate does not sign in to administrator portals.",
    "count": 3,
    "app_keys": [
      "notesstudio100",
      "aim990plus",
      "wifiaid"
    ],
    "paid_download_app_keys": [
      "aim990plus",
      "wifiaid"
    ],
    "free_iap_app_keys": [
      "notesstudio100"
    ]
  },
  "counts": {
    "apps": 46,
    "paid_upfront": 12,
    "free_to_start_with_iap": 34,
    "fully_free": 0,
    "ipad_supported": 46,
    "school_related": 10,
    "business_related": 7,
    "canary": 3
  },
  "apps": [
    {
      "app_key": "notesstudio100",
      "app_store_id": "6798813048",
      "bundle_id": "com.alice51849.NotesStudio100",
      "public_name": "100 Notes Studio: Pen & Paper",
      "canonical_app_store_url": "https://apps.apple.com/app/id6798813048",
      "campaign_app_store_url": "https://apps.apple.com/ca/app/id6798813048?pt=118326163&ct=iag_data_en_ca&mt=8",
      "campaign_attribution": {
        "provider_token": "118326163",
        "campaign_token": "iag_data_en_ca",
        "media_type": "8",
        "source": "verified_publisher_intent_catalog"
      },
      "platforms": [
        "iPhone",
        "iPad"
      ],
      "ipad_supported": true,
      "purchase_model": "free_with_lifetime_unlock",
      "purchase_model_wording": "Free to start · one-time unlock",
      "download_model": "free_download",
      "unlock_model": "optional_one_time_iap_individual_purchase",
      "deployment_class": "intune_direct_store_free_tier_evaluation",
      "publisher_query": "best offline handwriting notes app for ipad with pdf markup no subscription",
      "decision_context": "100 Notes Studio — 100 Notes Studio is a private, offline workspace for handwriting, typed notes, PDF markup, page-attached audio recordings and study. Free to start · One-time unlock · No subscription.",
      "related_fit": [
        "school"
      ],
      "canary": true,
      "canary_status": "BLOCKED_FREE_TIER_ONLY_IAP_NOT_DISTRIBUTABLE",
      "institutional_policy": {
        "classification": "free_download_with_lifetime_iap",
        "portal_visibility": "NOT_APPLICABLE_TO_IAP_UNLOCK",
        "device_assignment_language_allowed": false,
        "volume_procurement_language_allowed": false,
        "full_unlock_distribution": "NOT_APPLICABLE_REQUIRES_INDIVIDUAL_PERSONAL_APPLE_ACCOUNT"
      },
      "limitation": "Apple documents that in-app purchases are incompatible with volume purchasing, managed apps and Managed Apple Accounts. Device assignment must not be described as a complete unlock. A full unlock, when needed, must be purchased separately by each user with a personal Apple Account that can make in-app purchases.",
      "support_url": "https://alice51849.github.io/100notes-support/support.html",
      "privacy_url": "https://alice51849.github.io/100notes-support/privacy.html",
      "last_checked": "2026-08-29T19:55:38Z",
      "lookup_provenance": {
        "identity_platform_download": "https://itunes.apple.com/lookup?id=6798813048&country=us&entity=software",
        "support_privacy": "https://apps.apple.com/us/app/id6798813048",
        "method": "cross_validated_public_get",
        "public_name_rule": "exact_apple_us_trackName_and_canonical_brand_prefix",
        "owner_url_rule": "exact_first_party_registry_url_and_brand_receipt",
        "independent_pins": [
          "apple_lookup_receipt",
          "owner_support_registry",
          "portfolio_receipt"
        ]
      },
      "verified_live": true,
      "institutional_exposure_verified": false,
      "institutional_approval_verified": false,
      "discount_verified": false
    },
    {
      "app_key": "aibriefpack",
      "app_store_id": "6791658210",
      "bundle_id": "com.alice51849.AIBriefPack",
      "public_name": "AI Brief",
      "canonical_app_store_url": "https://apps.apple.com/app/id6791658210",
      "campaign_app_store_url": "https://apps.apple.com/ca/app/id6791658210?pt=118326163&ct=iag_data_en_ca&mt=8",
      "campaign_attribution": {
        "provider_token": "118326163",
        "campaign_token": "iag_data_en_ca",
        "media_type": "8",
        "source": "verified_publisher_intent_catalog"
      },
      "platforms": [
        "iPhone",
        "iPad"
      ],
      "ipad_supported": true,
      "purchase_model": "free_with_lifetime_unlock",
      "purchase_model_wording": "Free to start · one-time unlock",